{
  "model_evaluated": "logistic_regression",
  "split_evaluated": "test (random_stratified split)",
  "primary_metric": "roc_auc",
  "primary_metric_value": 0.8444632468113671,
  "metrics": {
    "roc_auc": 0.8444632468113671,
    "pr_auc": 0.63834437572134,
    "log_loss": 0.42721311206871604,
    "brier": 0.13802477957797626,
    "roc_auc_ci_low": 0.8084998741329156,
    "roc_auc_ci_high": 0.8782676493622733
  },
  "baseline_comparison": {
    "trivial_prior": {
      "roc_auc": 0.5,
      "note": "constant prediction from train"
    },
    "lightgbm": {
      "roc_auc": 0.8326806891922129,
      "note": "training contender, scored after selection; not used to choose"
    }
  },
  "threshold": null,
  "per_segment": {
    "gender": {
      "Female": {
        "rows": 300,
        "positives": 87,
        "roc_auc": 0.8518428579137661
      },
      "Male": {
        "rows": 300,
        "positives": 77,
        "roc_auc": 0.835769611554365
      }
    },
    "Partner": {
      "No": {
        "rows": 301,
        "positives": 109,
        "roc_auc": 0.792359518348624
      },
      "Yes": {
        "rows": 299,
        "positives": 55,
        "roc_auc": 0.8709388971684053
      }
    },
    "Dependents": {
      "No": {
        "rows": 404,
        "positives": 130,
        "roc_auc": 0.8164093206064009
      },
      "Yes": {
        "rows": 196,
        "positives": 34,
        "roc_auc": 0.8710965867828613
      }
    },
    "PhoneService": {
      "No": {
        "rows": 55,
        "positives": 9,
        "roc_auc": 0.8454106280193238
      },
      "Yes": {
        "rows": 545,
        "positives": 155,
        "roc_auc": 0.8438626964433417
      }
    },
    "MultipleLines": {
      "No": {
        "rows": 279,
        "positives": 77,
        "roc_auc": 0.8367943937250868
      },
      "No phone service": {
        "rows": 55,
        "positives": 9,
        "roc_auc": 0.8454106280193238
      },
      "Yes": {
        "rows": 266,
        "positives": 78,
        "roc_auc": 0.8512684124386252
      }
    },
    "InternetService": {
      "DSL": {
        "rows": 201,
        "positives": 40,
        "roc_auc": 0.8054347826086956
      },
      "Fiber optic": {
        "rows": 266,
        "positives": 117,
        "roc_auc": 0.7740205357655022
      },
      "No": {
        "rows": 133,
        "positives": 7,
        "roc_auc": 0.8854875283446713
      }
    },
    "OnlineSecurity": {
      "No": {
        "rows": 289,
        "positives": 130,
        "roc_auc": 0.7564344460570877
      },
      "No internet service": {
        "rows": 133,
        "positives": 7,
        "roc_auc": 0.8854875283446713
      },
      "Yes": {
        "rows": 178,
        "positives": 27,
        "roc_auc": 0.7777777777777778
      }
    },
    "OnlineBackup": {
      "No": {
        "rows": 255,
        "positives": 107,
        "roc_auc": 0.7757956554685527
      },
      "No internet service": {
        "rows": 133,
        "positives": 7,
        "roc_auc": 0.8854875283446713
      },
      "Yes": {
        "rows": 212,
        "positives": 50,
        "roc_auc": 0.7937037037037037
      }
    },
    "DeviceProtection": {
      "No": {
        "rows": 260,
        "positives": 114,
        "roc_auc": 0.740296803652968
      },
      "No internet service": {
        "rows": 133,
        "positives": 7,
        "roc_auc": 0.8854875283446713
      },
      "Yes": {
        "rows": 207,
        "positives": 43,
        "roc_auc": 0.8671298922291548
      }
    },
    "TechSupport": {
      "No": {
        "rows": 290,
        "positives": 126,
        "roc_auc": 0.7754307007355787
      },
      "No internet service": {
        "rows": 133,
        "positives": 7,
        "roc_auc": 0.8854875283446713
      },
      "Yes": {
        "rows": 177,
        "positives": 31,
        "roc_auc": 0.7677861246133451
      }
    },
    "StreamingTV": {
      "No": {
        "rows": 232,
        "positives": 78,
        "roc_auc": 0.7805111555111556
      },
      "No internet service": {
        "rows": 133,
        "positives": 7,
        "roc_auc": 0.8854875283446713
      },
      "Yes": {
        "rows": 235,
        "positives": 79,
        "roc_auc": 0.8407172995780591
      }
    },
    "StreamingMovies": {
      "No": {
        "rows": 240,
        "positives": 82,
        "roc_auc": 0.7744288360605125
      },
      "No internet service": {
        "rows": 133,
        "positives": 7,
        "roc_auc": 0.8854875283446713
      },
      "Yes": {
        "rows": 227,
        "positives": 75,
        "roc_auc": 0.8409649122807018
      }
    },
    "Contract": {
      "Month-to-month": {
        "rows": 313,
        "positives": 146,
        "roc_auc": 0.7316257895168568
      },
      "One year": {
        "rows": 134,
        "positives": 12,
        "roc_auc": 0.680327868852459
      },
      "Two year": {
        "rows": 153,
        "positives": 6,
        "roc_auc": 0.764172335600907
      }
    },
    "PaperlessBilling": {
      "No": {
        "rows": 256,
        "positives": 45,
        "roc_auc": 0.8832016850974197
      },
      "Yes": {
        "rows": 344,
        "positives": 119,
        "roc_auc": 0.8059943977591036
      }
    },
    "PaymentMethod": {
      "Bank transfer (automatic)": {
        "rows": 134,
        "positives": 26,
        "roc_auc": 0.8358262108262109
      },
      "Credit card (automatic)": {
        "rows": 135,
        "positives": 22,
        "roc_auc": 0.8407079646017699
      },
      "Electronic check": {
        "rows": 199,
        "positives": 93,
        "roc_auc": 0.7495942381821871
      },
      "Mailed check": {
        "rows": 132,
        "positives": 23,
        "roc_auc": 0.8524132429198245
      }
    }
  },
  "trust_checks": [
    {
      "name": "leakage",
      "passed": true,
      "detail": "Leakage suspects none; overlap with the 16 model features: none. Top permutation feature: tenure."
    },
    {
      "name": "too_good_to_be_true",
      "passed": true,
      "detail": "roc_auc 0.8445; best single feature tenure alone scores 0.7391; tenure carries 46% of permutation importance."
    },
    {
      "name": "cv_vs_test_gap",
      "passed": true,
      "detail": "Test 0.8445 vs CV 0.8507 +/- 0.0121 (gap -0.0062); tolerance max(2 x CV std, test 95% CI half-width 0.0349) = 0.0349."
    },
    {
      "name": "split_integrity",
      "passed": true,
      "detail": "Test rows 600 (profile 600), positives 164 (profile 164)"
    },
    {
      "name": "test_sample_size",
      "passed": true,
      "detail": "164 test positives; roc_auc 95% bootstrap CI [0.8085, 0.8783]"
    }
  ],
  "narrative": "The logistic_regression model scores roc_auc 0.844 on the held-out test data, against 0.500 for a constant prediction. All trust checks passed. The test score is uncertain by about +/-0.035 (95% bootstrap interval). ",
  "plots": [
    "outputs/report/evaluation_curves.png",
    "outputs/report/feature_importance.png"
  ],
  "findings": [
    "Test roc_auc 0.8445 (95% CI 0.8085-0.8783); CV 0.8507 +/- 0.0121.",
    "Trivial baseline (trivial_prior) roc_auc: 0.5000.",
    "lightgbm roc_auc: 0.8327 (training contender, scored after selection; not used to choose).",
    "All trust checks passed.",
    "Top driver on CV: tenure (46% of permutation importance)."
  ],
  "evaluation_script": "work/evaluate.py",
  "notes": "Model: outputs/model/model.joblib. Threshold rule: none."
}
